{
  "schema_version": "outline.v1",
  "book_id": "book_demo",
  "title": "示例书",
  "language": "zh-CN",
  "genre_profile": "general_serial",
  "status": "approved",
  "planned_words": 1000000,
  "planned_chapters": 500,
  "chapter_word_range": [
    2500,
    4500
  ],
  "point_of_view": "configurable",
  "tense": "configurable",
  "canon_policy": "strict",
  "created_at": "2026-09-29",
  "last_modified_at": "2026-09-29",
  "approval": {
    "owner": "author",
    "approved_at": "2026-09-29T18:00:00+08:00"
  }
}
